{
  "schema_version": 1,
  "scope": "Time/input metadata only. Nominal axes are not measured timestamps.",
  "origin_source_evidence": "example_script.m:51-70 uses deposited origin directly as a 1-based MATLAB column index. formatCellInf.m:100-117 indexes times(:,origin), subtracts its mean and remaps the origin index after time filtering.",
  "raw_time_checks": [
    {
      "group_id": "1b38366b-7473-4ddf-9cf9-26e625533686:/rep1",
      "time_channel": "general",
      "origin_stored": 49,
      "columns": 97,
      "nearest_zero_mean_time_column_1based": 49,
      "origin_equals_that_column": true,
      "mean_measured_relative_minutes_at_origin": -0.11738243320272727
    },
    {
      "group_id": "1b38366b-7473-4ddf-9cf9-26e625533686:/rep2",
      "time_channel": "general",
      "origin_stored": 49,
      "columns": 97,
      "nearest_zero_mean_time_column_1based": 49,
      "origin_equals_that_column": true,
      "mean_measured_relative_minutes_at_origin": 0.009247493117647058
    },
    {
      "group_id": "1b38366b-7473-4ddf-9cf9-26e625533686:/rep3",
      "time_channel": "general",
      "origin_stored": 49,
      "columns": 97,
      "nearest_zero_mean_time_column_1based": 49,
      "origin_equals_that_column": true,
      "mean_measured_relative_minutes_at_origin": 0.0010389017681683202
    },
    {
      "group_id": "1b38366b-7473-4ddf-9cf9-26e625533686:/rep4",
      "time_channel": "general",
      "origin_stored": 49,
      "columns": 97,
      "nearest_zero_mean_time_column_1based": 49,
      "origin_equals_that_column": true,
      "mean_measured_relative_minutes_at_origin": 0.0010101010038974356
    },
    {
      "group_id": "1b38366b-7473-4ddf-9cf9-26e625533686:/rep5",
      "time_channel": "general",
      "origin_stored": 49,
      "columns": 97,
      "nearest_zero_mean_time_column_1based": 49,
      "origin_equals_that_column": true,
      "mean_measured_relative_minutes_at_origin": -0.001509035695541404
    },
    {
      "group_id": "1b38366b-7473-4ddf-9cf9-26e625533686:/rep6",
      "time_channel": "general",
      "origin_stored": 49,
      "columns": 97,
      "nearest_zero_mean_time_column_1based": 49,
      "origin_equals_that_column": true,
      "mean_measured_relative_minutes_at_origin": -0.0005917464298037943
    },
    {
      "group_id": "32cf23e6-ff7c-4b41-8304-f60afca3f4a6:/dot6/gluc",
      "time_channel": "general",
      "origin_stored": 48,
      "columns": 96,
      "nearest_zero_mean_time_column_1based": 48,
      "origin_equals_that_column": true,
      "mean_measured_relative_minutes_at_origin": 0.0027643455831382973
    },
    {
      "group_id": "32cf23e6-ff7c-4b41-8304-f60afca3f4a6:/dot6/nacl",
      "time_channel": "general",
      "origin_stored": 49,
      "columns": 97,
      "nearest_zero_mean_time_column_1based": 49,
      "origin_equals_that_column": true,
      "mean_measured_relative_minutes_at_origin": -1.7053565559947096e-11
    },
    {
      "group_id": "32cf23e6-ff7c-4b41-8304-f60afca3f4a6:/dot6/oxid",
      "time_channel": "general",
      "origin_stored": 49,
      "columns": 97,
      "nearest_zero_mean_time_column_1based": 49,
      "origin_equals_that_column": true,
      "mean_measured_relative_minutes_at_origin": -0.001144219557252874
    },
    {
      "group_id": "32cf23e6-ff7c-4b41-8304-f60afca3f4a6:/hog1/gluc",
      "time_channel": "general",
      "origin_stored": 49,
      "columns": 97,
      "nearest_zero_mean_time_column_1based": 49,
      "origin_equals_that_column": true,
      "mean_measured_relative_minutes_at_origin": -1.2105524002805156e-13
    },
    {
      "group_id": "32cf23e6-ff7c-4b41-8304-f60afca3f4a6:/hog1/nacl",
      "time_channel": "general",
      "origin_stored": 49,
      "columns": 97,
      "nearest_zero_mean_time_column_1based": 49,
      "origin_equals_that_column": true,
      "mean_measured_relative_minutes_at_origin": -0.0014411126044666705
    },
    {
      "group_id": "32cf23e6-ff7c-4b41-8304-f60afca3f4a6:/hog1/oxid",
      "time_channel": "general",
      "origin_stored": 49,
      "columns": 97,
      "nearest_zero_mean_time_column_1based": 49,
      "origin_equals_that_column": true,
      "mean_measured_relative_minutes_at_origin": 0.0011497677574891048
    },
    {
      "group_id": "32cf23e6-ff7c-4b41-8304-f60afca3f4a6:/maf1/gluc",
      "time_channel": "general",
      "origin_stored": 49,
      "columns": 97,
      "nearest_zero_mean_time_column_1based": 49,
      "origin_equals_that_column": true,
      "mean_measured_relative_minutes_at_origin": -0.0008948355888790698
    },
    {
      "group_id": "32cf23e6-ff7c-4b41-8304-f60afca3f4a6:/maf1/nacl",
      "time_channel": "general",
      "origin_stored": 49,
      "columns": 97,
      "nearest_zero_mean_time_column_1based": 49,
      "origin_equals_that_column": true,
      "mean_measured_relative_minutes_at_origin": -0.007178403004475523
    },
    {
      "group_id": "32cf23e6-ff7c-4b41-8304-f60afca3f4a6:/maf1/oxid",
      "time_channel": "general",
      "origin_stored": 49,
      "columns": 97,
      "nearest_zero_mean_time_column_1based": 49,
      "origin_equals_that_column": true,
      "mean_measured_relative_minutes_at_origin": -0.0017201882368741712
    },
    {
      "group_id": "32cf23e6-ff7c-4b41-8304-f60afca3f4a6:/mig1/gluc",
      "time_channel": "general",
      "origin_stored": 49,
      "columns": 97,
      "nearest_zero_mean_time_column_1based": 49,
      "origin_equals_that_column": true,
      "mean_measured_relative_minutes_at_origin": 4.869350640221872e-12
    },
    {
      "group_id": "32cf23e6-ff7c-4b41-8304-f60afca3f4a6:/mig1/nacl",
      "time_channel": "general",
      "origin_stored": 49,
      "columns": 97,
      "nearest_zero_mean_time_column_1based": 49,
      "origin_equals_that_column": true,
      "mean_measured_relative_minutes_at_origin": 0.007342233004278846
    },
    {
      "group_id": "32cf23e6-ff7c-4b41-8304-f60afca3f4a6:/mig1/oxid",
      "time_channel": "general",
      "origin_stored": 49,
      "columns": 97,
      "nearest_zero_mean_time_column_1based": 49,
      "origin_equals_that_column": true,
      "mean_measured_relative_minutes_at_origin": -0.0008620689588965516
    },
    {
      "group_id": "32cf23e6-ff7c-4b41-8304-f60afca3f4a6:/mig2/gluc",
      "time_channel": "general",
      "origin_stored": 49,
      "columns": 97,
      "nearest_zero_mean_time_column_1based": 49,
      "origin_equals_that_column": true,
      "mean_measured_relative_minutes_at_origin": 1.7539313833109976e-12
    },
    {
      "group_id": "32cf23e6-ff7c-4b41-8304-f60afca3f4a6:/mig2/nacl",
      "time_channel": "general",
      "origin_stored": 49,
      "columns": 97,
      "nearest_zero_mean_time_column_1based": 49,
      "origin_equals_that_column": true,
      "mean_measured_relative_minutes_at_origin": 0.021863940636489363
    },
    {
      "group_id": "32cf23e6-ff7c-4b41-8304-f60afca3f4a6:/mig2/oxid",
      "time_channel": "general",
      "origin_stored": 49,
      "columns": 97,
      "nearest_zero_mean_time_column_1based": 49,
      "origin_equals_that_column": true,
      "mean_measured_relative_minutes_at_origin": -0.00103259397457798
    },
    {
      "group_id": "32cf23e6-ff7c-4b41-8304-f60afca3f4a6:/msn2/gluc",
      "time_channel": "general",
      "origin_stored": 49,
      "columns": 97,
      "nearest_zero_mean_time_column_1based": 49,
      "origin_equals_that_column": true,
      "mean_measured_relative_minutes_at_origin": 8.947091299576842e-12
    },
    {
      "group_id": "32cf23e6-ff7c-4b41-8304-f60afca3f4a6:/msn2/nacl",
      "time_channel": "general",
      "origin_stored": 49,
      "columns": 97,
      "nearest_zero_mean_time_column_1based": 49,
      "origin_equals_that_column": true,
      "mean_measured_relative_minutes_at_origin": -0.0007289544450000038
    },
    {
      "group_id": "32cf23e6-ff7c-4b41-8304-f60afca3f4a6:/msn2/oxid",
      "time_channel": "general",
      "origin_stored": 49,
      "columns": 97,
      "nearest_zero_mean_time_column_1based": 49,
      "origin_equals_that_column": true,
      "mean_measured_relative_minutes_at_origin": 0.0021295372667515925
    },
    {
      "group_id": "32cf23e6-ff7c-4b41-8304-f60afca3f4a6:/msn4/gluc",
      "time_channel": "general",
      "origin_stored": 49,
      "columns": 97,
      "nearest_zero_mean_time_column_1based": 49,
      "origin_equals_that_column": true,
      "mean_measured_relative_minutes_at_origin": 8.118788833603801e-13
    },
    {
      "group_id": "32cf23e6-ff7c-4b41-8304-f60afca3f4a6:/msn4/nacl",
      "time_channel": "general",
      "origin_stored": 49,
      "columns": 97,
      "nearest_zero_mean_time_column_1based": 49,
      "origin_equals_that_column": true,
      "mean_measured_relative_minutes_at_origin": -0.007826533428009614
    },
    {
      "group_id": "32cf23e6-ff7c-4b41-8304-f60afca3f4a6:/msn4/oxid",
      "time_channel": "general",
      "origin_stored": 49,
      "columns": 97,
      "nearest_zero_mean_time_column_1based": 49,
      "origin_equals_that_column": true,
      "mean_measured_relative_minutes_at_origin": 0.0024350380135593147
    },
    {
      "group_id": "32cf23e6-ff7c-4b41-8304-f60afca3f4a6:/sfp1/gluc",
      "time_channel": "general",
      "origin_stored": 49,
      "columns": 97,
      "nearest_zero_mean_time_column_1based": 49,
      "origin_equals_that_column": true,
      "mean_measured_relative_minutes_at_origin": -0.0005917464298037943
    },
    {
      "group_id": "32cf23e6-ff7c-4b41-8304-f60afca3f4a6:/sfp1/nacl",
      "time_channel": "general",
      "origin_stored": 49,
      "columns": 97,
      "nearest_zero_mean_time_column_1based": 49,
      "origin_equals_that_column": true,
      "mean_measured_relative_minutes_at_origin": -0.002123341467939692
    },
    {
      "group_id": "32cf23e6-ff7c-4b41-8304-f60afca3f4a6:/sfp1/oxid",
      "time_channel": "general",
      "origin_stored": 49,
      "columns": 97,